Pattern Name,Problem,Context,Solution,Result,Uses,cluster
Round-Trip Consistency Filtering (for Synthetic Data),"Automatically generated synthetic data, such as question-answer pairs, often contains noise, inconsistencies, or factual errors. Training AI models on low-quality synthetic data can lead to degraded performance and propagate inaccuracies.","Utilizing generative models to create large-scale synthetic training datasets (e.g., QA pairs from text passages) for domain adaptation or bootstrapping in data-scarce domains.","Implement a 'round-trip consistency' check as a post-generation filtering step. After a generative model produces a synthetic data point (e.g., a question-answer pair from a passage), a reverse or cross-validation step is performed. For instance, using the generated answer to regenerate the original question, or using the generated question to retrieve the original passage/answer. Only if the elements are consistent across this 'round trip' (e.g., the regenerated question is similar to the original, or the retrieved passage confirms the answer) is the synthetic data point accepted.","Significantly improves the quality, relevance, and factual consistency of synthetic training data. This leads to more robust and better-performing AI models, as they are trained on cleaner and more reliable automatically generated examples.","Filtering synthetic training data, improving data quality for machine learning, ensuring consistency in automatically generated content, self-supervision for data generation pipelines.",0
Self-Evaluation and Termination Condition (for iterative reasoning),"In iterative reasoning processes, determining when enough information has been gathered or when a satisfactory answer can be formulated is crucial to avoid unnecessary computation and ensure timely responses. Without this, the system might over-explore or provide incomplete answers.",An iterative LLM-based reasoning system (like ToG) that dynamically explores external knowledge sources (KGs) and needs to decide whether to continue exploration or conclude the reasoning process.,"After each exploration step, prompt the LLM to evaluate the current set of gathered reasoning paths and its inherent knowledge to determine if they are sufficient to answer the original question. If the LLM's evaluation is positive, the iterative process terminates, and the LLM proceeds to generate the answer. If negative, exploration continues, or a maximum depth limit is checked.",Optimizes computational resources by stopping exploration when sufficient information is found. Improves the quality of answers by ensuring the LLM has adequate context before generating a response. Enhances the agentic capabilities of the LLM by enabling it to make meta-decisions about its own reasoning progress.,"Iterative knowledge retrieval, multi-hop question answering, complex problem-solving with LLMs, and any agentic LLM workflow requiring dynamic termination based on information sufficiency.",1
SelfRefine,Iteratively improving LLM answers based on self-generated feedback.,When an initial answer from an LLM might be suboptimal and can be improved through an iterative feedback loop.,"Given an initial answer from the LLM, prompt the same LLM to provide feedback on the answer, and then prompt it to improve the answer based on the feedback. This iterative process continues until a stopping condition is met.","Demonstrated improvement across a range of reasoning, coding, and generation tasks.","Improving answer quality, iterative problem-solving, code refinement.",1
SelfAsk,Answering complex questions that might require follow-up information.,"When the initial prompt might be insufficient for a complete or accurate answer, and the LLM could benefit from asking clarifying questions.","Prompt LLMs to first decide if they need to ask follow-up questions. If so, the LLM generates these questions, then answers them, and finally answers the original question.","Enables LLMs to gather necessary information, leading to more comprehensive and accurate answers.","Complex question answering, information gathering, interactive problem-solving.",1
Cumulative Reasoning,Improving logical inference and mathematical problem-solving through iterative evaluation of reasoning steps.,"When a problem requires multiple reasoning steps, and each step needs to be evaluated before proceeding.","First, generate several potential steps in answering the question. Then, have an LLM evaluate them, deciding to either accept or reject these steps. Finally, check whether the final answer has been arrived at. If so, terminate; otherwise, repeat the process.",Demonstrated improvements in logical inference tasks and mathematical problems.,"Logical inference, mathematical problem-solving, iterative reasoning.",1
Parallel Tool Execution,"Sequential execution of subtasks, especially those that are independent, can lead to inefficiencies and longer task completion times in multi-step tool learning scenarios.","Complex tasks that can be decomposed into multiple subtasks, where some of these subtasks do not have interdependencies and can be processed concurrently.",Design the AI controller to determine dependencies among different subtasks and effectively switch between sequential and parallel execution. Independent subtasks are assigned to different agents or processes to be executed simultaneously.,Improved execution efficiency and reduced overall task completion time by leveraging concurrency for independent subtasks.,"Generating multiple independent code snippets, processing parallel data streams, orchestrating concurrent operations in complex workflows.",2
Plan-and-Solve Paradigm,"Large Language Models (LLMs) struggle with complex reasoning tasks, often failing to decompose them effectively or follow a structured approach.","Tasks that require multi-step reasoning or can be broken down into smaller, manageable subtasks for LLMs.","Prompt LLMs to first generate a high-level plan for solving the task, and then execute each reasoning step according to that plan. This encourages LLMs to decompose complex reasoning tasks into a series of subtasks and solve them step-by-step.",Improves LLMs' ability to handle and solve complex tasks by providing a structured approach to reasoning.,"Complex problem-solving, multi-step reasoning, task decomposition for LLMs.",2
Monte-Carlo Planning for Faithful Reasoning (FAME),"Ensuring the faithfulness of reasoning steps generated by Large Language Models (LLMs), especially in complex, multi-step reasoning.","Tasks where LLMs need to generate reasoning steps, and it's crucial that these steps are logically sound and factually correct.","Introduces Monte-Carlo planning techniques to guide the generation of reasoning steps. This involves exploring multiple possible reasoning paths and evaluating their faithfulness, potentially through sampling and simulation, to select the most reliable steps.","Generates more faithful reasoning steps, improving the overall reliability and trustworthiness of LLM reasoning.","Complex reasoning tasks, scenarios requiring high confidence in intermediate reasoning steps, exploration of reasoning alternatives.",2
Backtracking / Heuristic Search,"Autoregressive LLMs struggle with 'global planning scenarios' and 'anticipate future implications' because their sequential nature limits independent exploration of multiple future branches, leading to suboptimal or infeasible plans, especially under global constraints like budget.","An agent is generating a plan where decisions made early in the sequence have significant, long-term cost or feasibility implications, and a simple greedy approach is insufficient to satisfy global constraints.","Implement strategies that allow the agent to either 'backtrack' to previous decision points and explore alternative paths when a current path leads to a dead end or constraint violation, or employ 'heuristic methods for forward-looking planning' to estimate the future cost/benefit of current choices and guide the search towards promising solutions.","Enables the agent to find globally optimal or near-optimal solutions by systematically exploring the search space, recovering from suboptimal choices, and making more informed decisions that consider long-term consequences, especially for global constraints.","Adjusting plans to meet global constraints like budget or minimum night stays, exploring alternative options when initial choices lead to infeasibility.",2
Task Decomposition,"Complex, long-horizon tasks are often too difficult for an LLM to solve in a single step or prompt, leading to failures in planning and execution.","An agent is faced with a multi-faceted goal that requires breaking down into smaller, more manageable sub-problems or a sequence of actions.","The language agent uses its reasoning capabilities to break down the main task into a sequence of smaller, more tractable sub-tasks or steps. Each sub-task can then be addressed individually, often involving tool use or further reasoning, before integrating the sub-solutions into a complete plan.","Simplifies complex problems, makes them solvable by iterative steps, and improves the agent's ability to achieve long-term goals by managing complexity.","Breaking down travel planning into steps like analyzing constraints, collecting information through tools, and planning daily itineraries.",2
Cognitive Load Management,"Language agents, like humans, have limited cognitive capacity, and their performance deteriorates significantly when tasked with multiple complex, interdependent responsibilities simultaneously (e.g., information collection and planning).","An agent is required to perform a task that involves several distinct but interconnected sub-tasks, such as gathering information from external tools while simultaneously constructing a coherent plan based on that information and adhering to multiple constraints.","Design the agent's architecture or workflow to manage cognitive load by potentially separating or sequencing complex sub-tasks (e.g., a 'twostage mode' for information collection followed by planning). This might involve dedicated modules for different functions or explicit strategies to reduce the simultaneous demands on the core LLM.","Improves overall performance and reduces failure rates by preventing the agent from being overwhelmed by concurrent complex demands, allowing it to focus its 'cognitive capacity' more effectively on each stage or type of task.",Separating information collection from planning (as in the 'twostage mode') to prevent performance degradation when multitasking.,2
Planning,"LLMs struggle to solve complex tasks that require breaking down a problem into multiple, ordered steps and executing them sequentially.","Complex tasks cannot be solved in a single LLM inference step and require a strategic sequence of operations, potentially involving external tools or internal reasoning steps.",Enable LLMs to autonomously break down complex tasks into intermediate reasoning steps and devise a sequence of actions or tool calls to achieve a goal. This involves anticipating future steps and ordering operations logically.,"Allows LLMs to tackle more intricate problems, manage multi-stage processes, and achieve goals that require foresight and structured execution.","Multi-step problem-solving, complex task automation, agentic behavior, strategic decision-making.",2
Task Decomposition,"Complex tasks are often too large or multi-faceted for an LLM to solve in a single step or with a single tool call, leading to errors or incomplete solutions.","LLM-based agents need to process and respond to intricate queries or execute multi-stage operations that require breaking down the overall goal into smaller, manageable parts.","Enable the LLM to break down a complex task into a series of smaller, more manageable sub-tasks or intermediate reasoning steps. Each sub-task can then be addressed individually, potentially with specific tools, further reasoning, or by generating sub-goals.","Simplifies complex problem-solving, makes the reasoning process more transparent, facilitates the application of specialized tools to individual sub-problems, and improves the overall success rate on challenging tasks.","Multi-step question answering, complex problem-solving, automated task execution, agentic planning.",2
Structured Output / Plan Generation,"LLMs naturally generate free-form text, but many downstream applications or evaluation systems require information in a specific, structured format (e.g., JSON, XML, a predefined data structure).","An LLM is tasked with generating a complex output, such as a multi-day travel plan, where individual components (transportation, accommodation, meals, attractions) need to be clearly identifiable, parsable, and evaluable by automated systems.","1. Prompt Engineering: Instruct the LLM to generate its output directly in a structured format (e.g., JSON) or to follow a very strict natural language template that is easily parsable. 2. Post-processing: If the LLM generates natural language, use another LLM call or a rule-based parser to extract key components and organize them into the desired structured format.","Facilitates automated evaluation, integration with other systems, and ensures consistency and machine-readability of the LLM's generated plans or data.","Extracting key components from natural language plans (transportation, restaurants, attractions, accommodations) and organizing them into a formally structured plan for automatic evaluation.",2
Two-LLM Framework for Reasoning Step Selection and Generation,"Generating faithful and coherent reasoning steps with a single LLM can be challenging, as it needs to both propose and validate steps, potentially leading to self-reinforcement of errors or lack of critical evaluation.","Tasks requiring complex, multi-step reasoning where the quality and faithfulness of individual reasoning steps are crucial, and a more robust generation and validation mechanism is desired.","A framework that employs two distinct Large Language Models (LLMs) with specialized roles. One LLM is responsible for *selecting* or proposing potential reasoning steps, while the other LLM is dedicated to *generating* the actual content or details of those selected steps. This separation of concerns allows for a more deliberate and potentially more faithful reasoning process.","A more robust and potentially more faithful reasoning process by decoupling the selection/planning of reasoning steps from their detailed generation, allowing for specialized LLMs or different prompting strategies for each role.","Complex logical deduction, scientific synthesis, high-stakes reasoning where step-by-step validation is beneficial, improving faithfulness in LLM-generated explanations.",2
Planning with Introspective Reasoning,"Complex user tasks often require multi-step plans for tool use, but direct interaction with the environment for feedback might be unavailable or undesirable during initial plan generation. Models may generate unrealistic or nonsensical plans without grounding.","Scenarios where a foundation model needs to generate a sequence of tool actions or sub-tasks to achieve a goal, but without real-time environmental feedback during the planning phase.","The foundation model directly generates a static, multi-step plan for tool use. This leverages the model's inherent reasoning capabilities (e.g., Chain-of-Thought prompting) to decompose high-level tasks into sub-plans or generate executable code (e.g., Program-Aided Language Models, Code as Policies). Grounding mechanisms (e.g., value functions to estimate action success) can be used to make plans more realistic.","Generation of plausible, multi-step plans for complex tasks, often in the form of code or sequential decisions, without requiring iterative environmental interaction during planning.","Generating Python code for reasoning steps, creating executable programs for embodied agents, sequential decision-making in vision-language tasks (e.g., Visual ChatGPT).",2
Task Decomposition and Planning,User queries in real-world scenarios often embody complex intent that cannot be directly addressed by a single LLM response or a single tool invocation.,"A complex user question requiring multi-step actions and reasoning, where the LLM needs to orchestrate multiple operations.","The LLM analyzes the user's intent, decomposes the complex query into multiple solvable subquestions, and delineates the dependency relationships and execution sequence among these subtasks. This can be achieved through tuning-free methods (e.g., CoT, ReACT, prompt design) or tuning-based methods.","A structured plan of action that breaks down a complex problem into manageable, sequential or parallel subtasks, enabling the LLM to systematically address the overall query and prepare for subsequent tool interactions.","Breaking down complex user requests, preparing for tool selection and calling, enabling multi-step reasoning, orchestrating workflows.",2
Index Hotswapping (for Knowledge Updates),"Parametric-only language models struggle to update their world knowledge as information changes, requiring expensive and time-consuming retraining of the entire model, which can also lead to catastrophic forgetting.","AI systems that rely on external knowledge bases for factual accuracy, where the underlying world knowledge is dynamic and needs to be kept up-to-date without incurring high computational costs or risking model degradation.","For models with a nonparametric memory (like a dense vector index), simply replace the old document index with a new, updated index at test time. The parametric memory (generator) does not require retraining or fine-tuning, as its ability to access knowledge is inherent to the architecture.","Enables dynamic updating of the model's world knowledge, allowing it to answer questions based on the most current information (e.g., about recent world leaders) without the need for costly retraining. This provides a form of 'human-writable' memory.","Maintaining factual accuracy in knowledge-intensive AI applications, adapting to evolving information, providing interpretability through inspectable knowledge sources.",3
Human-Readable/Writable Nonparametric Memory,"Traditional parametric language models lack interpretability regarding their factual knowledge and are difficult to update or inspect. Their knowledge is implicitly stored in parameters, making it opaque and hard to modify.","AI systems requiring transparency, auditability, and dynamic knowledge updates, especially in knowledge-intensive applications where users might need to understand or modify the underlying factual basis.","Store external knowledge in a nonparametric memory comprised of raw, human-readable text documents (e.g., Wikipedia articles split into chunks). This memory is accessed via a retrieval mechanism. The raw text format allows for direct inspection of the evidence used by the model and enables dynamic updates by simply editing or replacing the document index.",Provides a form of interpretability by allowing inspection of the retrieved evidence. Enables easy and dynamic updating of the model's world knowledge (human-writable) without retraining the parametric components. Reduces hallucinations by grounding generation in explicit facts.,"Fact verification, open-domain QA, applications requiring explainability and up-to-date factual information.",3
Asynchronous Knowledge Base Updates,"Iteratively updating the embeddings and index of a large external knowledge base (e.g., millions of passages) during the end-to-end training of retrieval-augmented models is computationally intensive and time-consuming. Performing these updates synchronously would stall the main training loop, making the training process inefficient and slow.","Implementing end-to-end training for Retrieval Augmented Generation (RAG) models (like RAGend2end) where the passage encoder is finetuned, necessitating periodic re-encoding and re-indexing of the external knowledge base to reflect the updated embeddings.","Decouple the knowledge base update process from the main training loop by employing asynchronous parallel processes. This involves: 1) A main training loop that updates model gradients. 2) Dedicated re-encoding processes (e.g., on separate GPUs) that update the knowledge base embeddings using the latest passage encoder. 3) A re-indexing process (e.g., on separate CPUs using FAISS) that builds a new index from the updated embeddings. These processes run independently, with synchronization mechanisms (e.g., Python multiprocessing handles) to ensure correct sequencing (re-indexing follows re-encoding) and to load the newly created index into the main training loop when ready.","Enables efficient and scalable end-to-end training of RAG models with dynamic knowledge bases, significantly reducing training time by preventing the main loop from stalling. While it may introduce stale gradients, this has been shown not to significantly degrade model performance.","Optimizing the training pipeline for retrieval-augmented models with large, dynamic external knowledge bases, scaling end-to-end training for complex AI architectures.",3
Two-Stage QA Pipeline (Retriever-Reader Architecture),Answering open-domain questions requires efficiently searching a vast knowledge base and then precisely generating an answer. Directly generating from an entire knowledge base is computationally prohibitive and prone to factual errors or irrelevant information.,"Open-Domain Question Answering (ODQA) systems where answers are derived from a large, external corpus of documents or passages.","Decompose the ODQA task into two sequential, specialized stages:
1.  **Passage Retrieval**: A retriever component (e.g., TF-IDF, BM25, or a neural retriever like DPR) identifies and extracts a small set of passages or documents most relevant to the input question from a large external knowledge base.
2.  **Machine Comprehension/Answer Generation**: A reader or generator component (e.g., an extractive model like BERT or a generative model like BART/GPT-2) then processes these selected, relevant passages to comprehend the context and generate the final answer to the question.","Improves efficiency by significantly narrowing down the search space for the answer, allows for modular development and optimization of each stage, and is a foundational paradigm for building scalable and accurate ODQA systems.","Open-Domain Question Answering, knowledge-intensive information retrieval, building scalable QA systems from large corpora.",4
Control Token for Multi-task Generative Models,"When a single generative language model is trained to perform multiple distinct tasks (e.g., question answering, summarization, statement reconstruction) that might share similar input structures (e.g., retrieved passages), the model needs an explicit signal to differentiate between the intended tasks and condition its output accordingly.","Training sequence-to-sequence generative models (like BART) in a multi-task learning setup, especially within architectures like Retrieval Augmented Generation (RAG) where auxiliary tasks are introduced to enhance learning.","Prepend a unique, task-specific 'control token' (e.g., `[p]` for paraphrasing/reconstruction, or the question itself for QA) to the input sequence before feeding it to the generative model. This token acts as a prompt, signaling to the model which specific task it is expected to perform, thereby guiding its generation behavior.","Enables a single generative model to effectively learn and perform multiple distinct tasks, improving its versatility and allowing for synergistic learning across tasks. It helps the model condition its output based on the intended task, leading to more accurate and task-appropriate generations.","Multi-task learning with generative models, controlling generation style or task, differentiating between various input types for a unified model, prompt engineering for task-specific outputs.",4
