Pattern Name,Problem,Context,Solution,Result,Uses,cluster
Distractor-Aware Finetuning,"Large Language Models (LLMs) are vulnerable to irrelevant text in retrieved documents, which is a common occurrence in Retrieval Augmented Generation (RAG) settings. Training only with highly relevant documents can diminish the model's ability to discern and disregard irrelevant information, leading to decreased performance when distractors are present.",Finetuning LLMs for RAG tasks where the retrieval mechanism might provide a mix of relevant and irrelevant documents. The model needs to be robust to noise and effectively identify pertinent information within a potentially noisy context.,"During finetuning, integrate both golden (highly relevant) documents and distractor (irrelevant) documents into the training context. The model is explicitly trained to process this mixed context, learning to identify and utilize the relevant information while ignoring the irrelevant parts. This can involve varying the number of distractors and even presenting contexts with only distractors for a portion of the training data (e.g., 1-P fraction in RAFT).","Enhances the LLM's robustness against irrelevant text, making it more resilient to fluctuations in the number of documents encountered during testing. Improves performance on RAG tasks compared to training solely with golden documents, as the model learns to sift through noise.","Improving the reliability and accuracy of LLMs in RAG systems by making them robust to imperfect retrieval, ensuring they can effectively extract answers even when surrounded by irrelevant or misleading information.",26
End-to-End Retriever Training (for RAG Domain Adaptation),"The original RAG architecture, by keeping the passage encoder and external knowledge base fixed during finetuning, struggles to adapt effectively to specialized domains where the knowledge distribution differs significantly from its pre-training data (e.g., Wikipedia). This can lead to suboptimal retrieval and generation performance in new domains.","Adapting Retrieval Augmented Generation (RAG) models to perform Open-Domain Question Answering (ODQA) or other knowledge-intensive tasks within specific, specialized domains (e.g., healthcare, news, conversations) that utilize a domain-specific external knowledge base.","Extend the RAG architecture to enable full end-to-end trainability of all its components. This involves finetuning both the question encoder (EQ) and the passage encoder (EP) of the Dense Passage Retrieval (DPR) component, and dynamically updating (re-encoding and re-indexing) the external knowledge base embeddings during the training process. This allows gradients to propagate through the entire retrieval and generation pipeline, optimizing the retriever for the target domain.","Achieves significant performance improvements in domain adaptation for RAG models across various metrics (Exact Match, F1, Top-K retrieval accuracy). It enables the retriever to learn domain-specific representations, outperforming models with fixed retrievers or independently finetuned retrievers.","Improving the domain adaptation capabilities of RAG models, training domain-specific neural retrievers, enhancing performance in specialized ODQA tasks.",26
Synthetic QA Data Generation,"The scarcity or complete absence of large-scale, human-annotated question-answering (QA) datasets for specialized domains makes it challenging to train and adapt AI models like RAG or its components (e.g., DPR) for those domains.","Developing and adapting AI models for Open-Domain Question Answering (ODQA) or other knowledge-intensive tasks in data-scarce or emerging domains (e.g., COVID-19 research, new topics in news or conversations) where manual annotation of QA pairs is prohibitively expensive or time-consuming.","Leverage existing pre-trained generative models (e.g., a BART seq2seq model finetuned on a general QA dataset like SQuAD) to automatically generate synthetic question-answer pairs from raw text passages within the target domain's knowledge base. Employ filtering techniques, such as round-trip consistency, to improve the quality and relevance of the generated synthetic data.","Provides a scalable and cost-effective method to create extensive domain-specific QA datasets, enabling effective training and domain adaptation of AI models even when human-labeled data is minimal. This allows for the finetuning of components like DPR or the entire RAG model.","Bootstrapping training data for new or specialized domains, reducing reliance on manual data annotation, enabling domain adaptation in data-limited scenarios, generating hard negative examples for retriever training.",26
Open-Book Question Answering with InContext RALM,"Enabling frozen, pre-trained Language Models to answer open-domain questions accurately by leveraging external knowledge, without requiring fine-tuning or specific pre-training for QA.","A large, pre-trained LM (e.g., LLaMA) is available, but it lacks the specific knowledge or reasoning capabilities to answer open-domain questions reliably in a 'closed-book' setting. Fine-tuning is not desired or possible.","Extend the standard question-answering prompt by prepending relevant documents retrieved from a knowledge source (e.g., Wikipedia via DPR) to the LM's input. The LM then processes this augmented prompt (documents + question) to generate the answer. The number of documents can be optimized.","Significantly boosted performance in open-domain question answering tasks (e.g., exact match scores on NQ and TriviaQA) for frozen LMs, demonstrating their ability to leverage retrieved documents without further training.","Building robust open-domain question answering systems, improving factual accuracy in QA, leveraging general-purpose LMs for knowledge-intensive tasks.",26
Retriever-Aware Training (RAT),"Large Language Models (LLMs) struggle to effectively use external tools via API calls, especially when the available APIs are massive, frequently updated, and the LLM is unaware of their existence or usage. Naive retrieval augmentation can sometimes hurt performance if the retrieved documents are irrelevant or inaccurate.","An LLM needs to interact with a dynamic and extensive set of external APIs, whose documentation changes over time. The LLM must not only leverage this documentation but also learn to critically evaluate its relevance and accuracy during inference.","The LLM is finetuned on an instruction-tuned dataset where the user prompt is augmented with retrieved documentation. Crucially, the training process includes potentially incorrect retrieved documentation alongside the accurate ground truth in the LLM's response. This teaches the LLM to 'judge the retriever' at inference time, enabling it to use relevant documentation and ignore irrelevant context, relying on its baked-in domain-specific knowledge when retrieval fails. During inference, a retriever (e.g., BM25, GPTIndex) fetches the most up-to-date API documentation, which is then concatenated to the user prompt.","The LLM demonstrates a strong capability to adapt to test-time document changes (e.g., API version updates, argument changes), improves performance compared to in-context learning, and substantially mitigates API argument hallucination errors. It maintains efficacy and accuracy over time despite documentation evolution.","Enhancing LLMs for dynamic tool use, improving reliability of API generation, reducing hallucination in tool invocation, adapting to frequently updated documentation.",26
Finetuning for Controlled Abstention,"LLMs, especially in RAG settings, often hallucinate incorrect answers rather than abstaining when they lack sufficient information, leading to untrustworthy outputs.",Developing and deploying LLMs where it is crucial for the model to explicitly indicate uncertainty ('I don't know') instead of generating potentially harmful or incorrect information.,"1. Prepare a finetuning dataset where a subset of training examples (e.g., 20% randomly selected or 20% identified as having insufficient context) has its ground truth answer replaced with an explicit 'I don't know' response. 2. Apply LoRA adaptation to finetune the LLM (e.g., Mistral 3 7B) on this modified dataset.","Finetuned models show a higher rate of correct answers in some cases and increased abstention compared to models trained without 'I don't know' examples. However, it's noted that this approach alone doesn't easily reduce the hallucination rate and may increase abstention at the cost of fewer correct answers, suggesting further research is needed for optimal strategies.",Attempting to reduce LLM hallucinations by encouraging explicit abstention; Steering LLM behavior during training to improve trustworthiness.,26
Prompt-Tuning a Frozen LM as a Reader,"Adapting a pre-trained, frozen Language Model for a specific downstream task (e.g., Open-Domain Question Answering) without fine-tuning its weights, which can be costly or impossible.","A frozen LM is available, and it needs to perform a specific 'reading' task (like extracting answers from text or understanding a query) within a larger system (e.g., a RALM or QA system).","Instead of fine-tuning the LM's weights, design specific prompts or 'prompt-tunes' that guide the frozen LM to perform the desired task. This involves crafting the input text to elicit the correct behavior from the LM.","Enables frozen LMs to achieve competitive performance on downstream knowledge-intensive tasks like Open-Domain Question Answering, leveraging their pre-trained capabilities without expensive retraining.","Adapting LMs for QA, summarization, information extraction, or other specific tasks where fine-tuning is not an option.",26
Selective Generation with Sufficient Context Signal,"Large Language Models (LLMs) in Retrieval Augmented Generation (RAG) systems frequently hallucinate incorrect answers instead of abstaining, particularly when the provided context is insufficient. This reduces trustworthiness and overall accuracy.","Deploying RAG systems in applications requiring high accuracy and reliability, where abstaining from an answer is preferable to generating a hallucinated one (e.g., medical, legal domains).","1. Utilize two abstention signals: Model Self-rated Confidence (the LLM's estimated probability of correctness) and Sufficient Context Autorater Output (a binary label indicating context sufficiency). 2. Train a simple logistic regression model using these signals to predict the likelihood of hallucination. 3. At inference time, apply a threshold to the logistic regression model's score: if the score falls below the threshold, the LLM abstains; otherwise, it generates an answer. This allows for a controllable accuracy-coverage tradeoff.","Significantly improves the selective accuracy-coverage tradeoff, leading to gains of 2-10% in the fraction of correct answers among total model responses compared to using self-rated confidence alone. Offers a controllable mechanism for tuning abstention behavior.",Reducing hallucinations and improving trustworthiness in RAG systems; Implementing controllable accuracy-coverage tradeoffs in LLM applications; Guiding LLMs to abstain when uncertain or when context is inadequate.,27
Sample-Efficient RL with Reference Reuse,"Reinforcement Learning (RL) for multi-stage tasks can be highly sample-inefficient, particularly when certain critical stages (e.g., answer generation) are shorter or less frequent but contribute significantly to the overall reward, while other stages (e.g., browsing) are longer and more exploratory.","An RL agent is trained on a task composed of sequential phases (e.g., a browsing phase followed by an answering phase), where the reward is primarily determined by the outcome of a later, shorter phase, and the initial phases are computationally expensive or time-consuming.","To improve sample efficiency, after a complete multi-phase episode, generate additional 'answering-only' episodes. In these supplementary episodes, the agent is provided with the references (or relevant information) collected during the preceding full browsing phase and is tasked solely with optimizing its answer generation based on that fixed set of references.","Significantly boosts the sample efficiency of RL training by allowing the model to practice and optimize the high-impact, shorter phases (like answer generation) more frequently without repeatedly incurring the computational cost of the longer, exploratory phases (like web browsing). This leads to faster learning and improved overall performance.","Accelerating RL training for multi-stage tasks, optimizing specific sub-components of an agent's behavior, reducing computational costs in complex RL environments.",27
Sufficient Context Autorater,"Accurately and scalably determining if a given context provides enough information for an LLM to answer a query, especially in Retrieval Augmented Generation (RAG) systems, without relying on a ground truth answer. Prior methods lacked a precise definition of relevance.","Analyzing and improving Retrieval Augmented Generation (RAG) systems, evaluating LLM performance with varying context quality, or preparing datasets for RAG. The goal is to distinguish between LLM failures to utilize context and context insufficiency.","1. Define 'Sufficient Context': An instance (Q, C) has sufficient context if there exists a plausible answer A to Q given C. This definition does not require a pre-existing ground truth answer. 2. Implement an 'Autorater': Use a powerful LLM (e.g., Gemini 1.5 Pro 1-shot) prompted with the sufficient context definition and examples to classify query-context pairs as 'sufficient' or 'insufficient'.","Achieves 93% accuracy in classifying sufficient context, enabling scalable labeling of instances. Provides crucial insights into LLM behavior in RAG, revealing that models hallucinate even with sufficient context and often hallucinate more than abstain with insufficient context.","Analyzing RAG system performance and error stratification; Data labeling for RAG datasets; Providing a signal for downstream AI components, such as selective generation.",27
Iterative Retrieval and Decision-Making,"In RAG systems, a single retrieval step might not provide sufficient or optimal context, leading to suboptimal answers or hallucinations. The system needs to dynamically decide if more information is needed or if it should abstain.","RAG systems where the quality or completeness of initial retrieved context is uncertain, and the system needs to adapt its information gathering strategy dynamically to improve accuracy and reduce errors.","After an initial retrieval, the system evaluates the sufficiency of the current context (e.g., using a 'Sufficient Context Autorater' or a confidence score). Based on this evaluation, it makes a decision: 1) Generate an answer if the context is deemed sufficient and confidence is high. 2) Refine the query and perform another retrieval step if the context is insufficient but potentially retrievable. 3) Abstain if the context is insufficient and further retrieval is unlikely to help, or if overall confidence is too low.","Potentially higher accuracy by ensuring more relevant and sufficient context, reduced hallucinations by abstaining when truly uncertain, and more efficient use of retrieval resources by avoiding unnecessary generation or retrieval.","Enhancing RAG systems with dynamic information gathering, improving robustness to initial retrieval failures, optimizing resource usage in complex question answering, enabling adaptive LLM behavior.",27
Conditional Retrieval,"Fixed-interval retrieval (e.g., using a retrieval stride) can be inefficient, leading to unnecessary retrieval calls when not needed, or missing critical retrieval opportunities when needed more frequently. This impacts latency and cost.","An InContext RALM system is operating, and there's a desire to optimize retrieval operations beyond fixed intervals, making them more dynamic and efficient.","Employ a specialized model to predict when retrieval is needed. Instead of retrieving documents at a fixed stride, the system only triggers a retrieval operation when this predictive model indicates that external knowledge is likely to be beneficial or necessary for the upcoming generation.","Potential for large latency and cost gains by retrieving more sparsely and only when contextually relevant, leading to a more efficient and potentially more performant RALM system.","Optimizing resource utilization in RALM, reducing inference costs, improving real-time performance of knowledge-augmented LMs.",27
Self-Reflection for RAG (SelfRAG),Retrieval-Augmented Generation (RAG) systems can suffer from suboptimal retrieval or generation if they lack an internal mechanism to critically evaluate and improve their own process and outputs.,Advanced RAG systems where the LLM needs to not only retrieve and generate but also actively critique its own performance and adapt its strategy to enhance the quality and reliability of its responses.,"Train an LLM to dynamically retrieve, generate, and *critique* its own generated text and the relevance of retrieved documents through a self-reflection mechanism. This involves the model predicting a special retrieval token to trigger document retrieval, and then evaluating the retrieved content and its own generated answer, potentially leading to further retrieval, refinement, or alternative generation paths.","Significantly improves the quality, accuracy, and reliability of RAG outputs by enabling the LLM to self-correct, refine its responses, and make more informed decisions about when and what to retrieve, acting as a more sophisticated and autonomous agent.","Advanced RAG systems, self-improving AI agents, quality assurance in generative AI, complex reasoning tasks requiring internal evaluation and adaptation.",27
Dynamic Speculative Pipelining for RAG,"In RAG workflows, the retrieval step (often CPU-bound) and the LLM generation step (GPU-bound) are typically executed sequentially. This sequential execution leads to idle GPU resources during retrieval and prolonged end-to-end latency, particularly when retrieval latency is significant.","RAG systems where vector search can produce preliminary candidate documents early in its process, even before the final, most relevant documents are fully determined. The goal is to reduce overall latency by overlapping these two distinct computational phases.","Dynamically overlap the knowledge retrieval and LLM inference steps. The retrieval process is split into stages, and at each stage, candidate documents are sent to the LLM engine for 'speculative generation.' If subsequent stages yield different candidate documents, the previous speculative generation is terminated, and a new one is initiated. If the documents remain the same, the LLM continues processing the current speculative generation. The strategy is dynamically enabled based on system load (e.g., only when the number of pending LLM requests falls below a certain threshold).",Achieves up to 16% Time to First Token (TTFT) reduction. Decreases non-overlapping vector search time by 15-43%. Minimizes end-to-end latency by parallelizing retrieval and generation while managing the overhead of incorrect speculations.,"Reducing end-to-end latency in RAG systems by intelligently overlapping the knowledge retrieval and LLM generation phases, especially when retrieval is time-consuming.",27
Adaptive Retrieval (Entity Frequency-based),"Incurring retrieval overhead for simple queries or failing to retrieve for complex ones, without a dynamic decision mechanism. Traditional RAG approaches apply retrieval uniformly, which is inefficient for queries easily answerable by the LLM's parametric memory.","LLM-based Question Answering (QA) systems where some queries might be answerable by the LLM's parametric memory, while others require external knowledge, and a simple heuristic can differentiate between them to optimize retrieval usage.","Dynamically decide whether to retrieve documents or not based on the frequency of entities found in the query. If the frequency of entities in a query falls below a certain predefined threshold (implying less common or more specific knowledge), activate the retrieval module. Otherwise, rely solely on the LLM's internal knowledge (no retrieval).","Reduces unnecessary retrieval operations for common knowledge queries, thereby improving efficiency and reducing computational costs. However, this approach is often overly simplistic and may not be sufficient for complex multi-hop queries that require deep reasoning or synthesis from multiple documents.","Simple adaptive RAG decision-making, efficiency optimization for LLM applications with varying query types, as a baseline for more sophisticated adaptive systems, scenarios where a quick heuristic is preferred over a complex classifier.",27
Iterative Retrieval-Augmented Generation (Iterative RAG),"A single retrieval step at the beginning of RAG might not provide sufficient or optimally refined context for complex, multi-step, or evolving generation tasks, potentially leading to less accurate or complete responses.","RAG systems dealing with complex queries, multi-turn conversations, or tasks requiring dynamic information gathering where the relevance of retrieved documents might change or new information is needed as the LLM generates parts of the response.","Instead of a single retrieval at the beginning, the RAG process involves multiple retrieval steps interleaved with the generation process. After an initial generation, the LLM (or a controller) can identify new information needs or refine existing queries, triggering subsequent retrieval rounds. The newly retrieved documents then augment the context for further generation. RAGCache supports this by treating intermediate iterations as separate requests and caching their KV cache.","Improved response quality for complex tasks, better contextual understanding, and the ability to dynamically adapt to evolving information needs during generation.","Multi-hop question answering, complex content creation, reasoning tasks that require dynamic information gathering, conversational AI.",27
Confidence-Based Iterative Retrieval,"LLMs may generate responses with low confidence or factual inaccuracies when their internal knowledge or initially retrieved documents are insufficient, leading to unreliable outputs.","Generative LLM applications, particularly in Question Answering, where the quality and factual accuracy of generated text are critical, and the system needs a mechanism to dynamically seek more information when uncertain.","Monitor the confidence level of tokens or sentences generated by the LLM. If the confidence falls below a predefined threshold, trigger an additional retrieval step to fetch new, potentially more relevant or supplementary documents. This process can be repeated iteratively until the LLM's confidence in its generated output is sufficient or a maximum number of retrieval steps is reached.","Improves the reliability and accuracy of LLM-generated responses by dynamically addressing knowledge gaps or uncertainties. It allows the system to self-correct and enhance its information base during generation, reducing factual errors and improving overall output quality.","Real-time fact-checking, dynamic knowledge augmentation, improving robustness of generative AI, reducing hallucinations based on internal uncertainty signals.",27
Adaptive Retrieval-Augmented Generation (AdaptiveRAG),"Existing Retrieval-Augmented Large Language Models (LLMs) either incur unnecessary computational overhead for simple queries (e.g., multi-step approaches) or fail to adequately address complex multi-step queries (e.g., single-step or no retrieval approaches), leading to suboptimal efficiency and accuracy across diverse query complexities. One-size-fits-all approaches are inadequate for real-world scenarios with varying query difficulties.","Developing Question Answering (QA) systems or other LLM applications that need to provide accurate and efficient responses to user queries, where the complexity of these queries can range from straightforward to highly complex and multi-hop.","Dynamically select the most suitable strategy for retrieval-augmented LLMs from a range of options (no retrieval, single-step retrieval, or multi-step iterative retrieval) based on the predicted complexity level of the incoming query. This selection process is operationalized by a smaller Language Model (Classifier) trained to predict the query's complexity. The system seamlessly adapts its operational strategy without changing internal model architecture or parameters.","Significantly enhances the overall efficiency and accuracy of QA systems. It optimizes resource allocation by applying simpler, more efficient methods for straightforward queries and more rigorous, iterative methods for complex queries, thereby avoiding unnecessary computational overhead or insufficient handling.","Question Answering systems, information retrieval, dynamic resource management in LLM applications, any LLM-based system where query complexity varies and different processing strategies are optimal.",27
